{
  "$schema": "https://json-schema.org/draft/2020-12/schema",
  "title": "Orchestration Manifest",
  "description": "Per-user autonomous job configuration: launchd plists, cron schedules, tripwires, observability. Populated by onboarding interview; owned by librarian post-seed.",
  "type": "object",
  "required": ["schema_version", "platform", "jobs", "tripwires", "observability"],
  "properties": {
    "schema_version": {
      "type": "string",
      "pattern": "^[0-9]+\\.[0-9]+\\.[0-9]+$"
    },
    "platform": {
      "const": "darwin-launchd"
    },
    "jobs": {
      "type": "array",
      "items": {
        "type": "object",
        "required": ["id", "enabled", "schedule", "command", "log_path", "idle_watchdog_sec"],
        "properties": {
          "id": {
            "type": "string",
            "pattern": "^[a-z][a-z0-9-]*$"
          },
          "enabled": {
            "type": "boolean",
            "default": false
          },
          "schedule": {
            "type": "object",
            "oneOf": [
              {
                "type": "object",
                "required": ["hour", "minute"],
                "properties": {
                  "hour": { "type": "integer", "minimum": 0, "maximum": 23 },
                  "minute": { "type": "integer", "minimum": 0, "maximum": 59 },
                  "dow": {
                    "type": "array",
                    "items": { "type": "integer", "minimum": 0, "maximum": 6 }
                  }
                }
              },
              {
                "type": "object",
                "required": ["interval_sec"],
                "properties": {
                  "interval_sec": { "type": "integer", "minimum": 60 }
                }
              }
            ]
          },
          "command": { "type": "string" },
          "log_path": { "type": "string" },
          "idle_watchdog_sec": {
            "type": "integer",
            "default": 180
          },
          "single_instance": {
            "type": "boolean",
            "default": true,
            "description": "Use lockf -k -t 0 re-exec pattern"
          },
          "cold_wake_probe": {
            "type": "boolean",
            "default": true
          }
        }
      }
    },
    "tripwires": {
      "type": "array",
      "items": {
        "type": "object",
        "required": ["id", "semantics", "contract"],
        "properties": {
          "id": { "type": "string" },
          "semantics": { "enum": ["contents", "existence"] },
          "contract": {
            "type": "string",
            "description": "Human-readable failure mode"
          },
          "path": { "type": "string" },
          "expected_contents_regex": { "type": "string" }
        }
      }
    },
    "observability": {
      "type": "object",
      "required": ["morning_brief_staleness_h", "librarian_staleness_h", "sessionstart_banner_staleness_h"],
      "properties": {
        "morning_brief_staleness_h": { "type": "integer", "default": 48 },
        "librarian_staleness_h": { "type": "integer", "default": 24 },
        "sessionstart_banner_staleness_h": { "type": "integer", "default": 24 },
        "filename_epoch_parsing": { "type": "boolean", "default": true }
      }
    }
  }
}
